{
  "$schema": "https://json-schema.org/draft/2020-12/schema",
  "$id": "https://traceknot.kyungho.info/schemas/evidence.v1.json",
  "title": "Verification evidence",
  "type": "object",
  "additionalProperties": false,
  "required": ["schemaVersion", "evidenceId", "requestId", "snapshotId", "obligationId", "producer", "execution", "result", "observedAt"],
  "properties": {
    "schemaVersion": { "const": "verification-evidence/v1" },
    "evidenceId": { "type": "string", "minLength": 1 },
    "requestId": { "type": "string", "minLength": 1 },
    "snapshotId": { "type": "string", "minLength": 1 },
    "obligationId": { "type": "string", "minLength": 1 },
    "producer": {
      "type": "object", "additionalProperties": false,
      "required": ["kind", "identity", "independence"],
      "properties": {
        "kind": { "enum": ["self", "harness-managed", "deterministic-verifier", "ci", "human", "external-system"] },
        "identity": { "type": "string", "minLength": 1 },
        "independence": { "enum": ["self-check", "separate-verification-context", "independent-producer", "external-approval"] }
      }
    },
    "execution": {
      "type": "object", "additionalProperties": false,
      "required": ["kind", "identity", "startedAt", "finishedAt", "exitStatus"],
      "properties": {
        "kind": { "enum": ["command", "browser", "review", "experiment", "approval"] },
        "identity": { "type": "string", "minLength": 1 },
        "startedAt": { "type": "string", "pattern": "^\\d{4}-\\d{2}-\\d{2}T\\d{2}:\\d{2}:\\d{2}(?:\\.\\d+)?Z$" },
        "finishedAt": { "type": "string", "pattern": "^\\d{4}-\\d{2}-\\d{2}T\\d{2}:\\d{2}:\\d{2}(?:\\.\\d+)?Z$" },
        "exitStatus": { "enum": ["passed", "failed", "blocked", "cancelled", "timed-out"] },
        "exitCode": { "type": "integer" }
      }
    },
    "result": {
      "type": "object", "additionalProperties": false,
      "required": ["verdict", "summary"],
      "properties": {
        "verdict": { "enum": ["PASS", "FAIL", "BLOCKED", "INCOMPLETE"] },
        "summary": { "type": "string", "minLength": 1 },
        "passed": { "type": "integer", "minimum": 0 },
        "failed": { "type": "integer", "minimum": 0 },
        "artifacts": { "type": "array", "items": { "type": "string", "minLength": 1 }, "uniqueItems": true }
      }
    },
    "observedAt": { "type": "string", "pattern": "^\\d{4}-\\d{2}-\\d{2}T\\d{2}:\\d{2}:\\d{2}(?:\\.\\d+)?Z$" },
    "contentHash": { "type": "string", "pattern": "^[a-f0-9]{64}$" }
  }
}
